{
  "capacity": {
    "advertised_bytes": 8589934592,
    "backing_bytes": 8589934592,
    "remote_bytes": 0
  },
  "connection": {
    "healthy_providers": 0,
    "providers": [
      {
        "provider_id": "provider-a",
        "state": "not-connected"
      }
    ],
    "state": "not-connected",
    "total_providers": 1
  },
  "device": {
    "acknowledgement_policy": "strict",
    "lifecycle": "active",
    "mode": "backed",
    "name": "infiniswap0",
    "path": "/dev/infiniswap0",
    "provider_failure_deadline_ms": 2000,
    "swap": {
      "configured_priority": 100,
      "enabled": true,
      "priority": 100
    }
  },
  "kind": "infiniswap.device-status",
  "last_error": null,
  "schema_version": 1
}
